category,gradeband,name,standard,description,framework
D3.Claims,3-5,Identify evidence that draws information from multiple sources in response to compelling questions.,D3.3.3-5,Identify evidence that draws information from multiple sources in response to compelling questions.,c3ss
D3.Claims,3-5,Use evidence to develop claims in response to compelling questions.,D3.4.3-5,Use evidence to develop claims in response to compelling questions.,c3ss
D4.Conclusions,3-5,Construct arguments using claims and evidence from multiple sources.,D4.1.3-5,Construct arguments using claims and evidence from multiple sources.,c3ss
D4.Conclusions,3-5,"Construct explanations using reasoning, correct sequence, examples, and details with relevant information and data.",D4.2.3-5,"Construct explanations using reasoning, correct sequence, examples, and details with relevant information and data.",c3ss
D4.Conclusions,3-5,"Present a summary of arguments and explanations to others outside the classroom using print and oral technologies (e.g., posters, essays, letters, debates, speeches, and reports) and digital technologies (e.g., Internet, social media, and digital documentary). ",D4.3.3-5,"Present a summary of arguments and explanations to others outside the classroom using print and oral technologies (e.g., posters, essays, letters, debates, speeches, and reports) and digital technologies (e.g., Internet, social media, and digital documentary). ",c3ss
D4.Conclusions,3-5,Critique arguments.,D4.4.3-5,Critique arguments.,c3ss
D4.Conclusions,3-5,Critique explanations.,D4.5.3-5,Critique explanations.,c3ss
D4.Action,3-5,"Draw on disciplinary concepts to explain the challenges people have faced and opportunities they have created, in addressing local, regional, and global problems at various times and places.",D4.6.3-5,"Draw on disciplinary concepts to explain the challenges people have faced and opportunities they have created, in addressing local, regional, and global problems at various times and places.",c3ss
D4.Action,3-5,"Explain different strategies and approaches students and others could take in working alone and together to address local, regional, and global problems, and predict possible results of their actions.",D4.7.3-5,"Explain different strategies and approaches students and others could take in working alone and together to address local, regional, and global problems, and predict possible results of their actions.",c3ss
D4.Action,3-5,Use a range of deliberative and democratic procedures to make decisions about and act on civic problems in their classrooms and schools.,D4.8.3-5,Use a range of deliberative and democratic procedures to make decisions about and act on civic problems in their classrooms and schools.,c3ss
D1,6-8,Explain how a question represents key ideas in the field,D1.1.6-8,Explain how a question represents key ideas in the field,c3ss
D1,6-8,Explain points of agreement experts have about interpretations and applications of disciplinary concepts and ideas associated with a supporting question.,D1.3.6-8,Explain points of agreement experts have about interpretations and applications of disciplinary concepts and ideas associated with a supporting question.,c3ss
D1,6-8,"Determine the kinds of sources that will be helpful in answering compelling and supporting questions, taking into consideration multiple points of views represented in the sources.",D1.5.6-8,"Determine the kinds of sources that will be helpful in answering compelling and supporting questions, taking into consideration multiple points of views represented in the sources.",c3ss
D1,6-8,Explain points of agreement experts have about interpretations and applications of disciplinary concepts and ideas associated with a compelling question.,D1.2.6-8,Explain points of agreement experts have about interpretations and applications of disciplinary concepts and ideas associated with a compelling question.,c3ss
D1,6-8,Explain how the relationship between supporting questions and compelling questions is mutually reinforcing.,D1.4.6-8,Explain how the relationship between supporting questions and compelling questions is mutually reinforcing.,c3ss
D2.Civ,6-8,"Distinguish the powers and responsibilities of citizens, political parties, interest groups, and the media in a variety of governmental and nongovernmental contexts.",D2.Civ.1.6-8,"Distinguish the powers and responsibilities of citizens, political parties, interest groups, and the media in a variety of governmental and nongovernmental contexts.",c3ss
D2.Civ,6-8,"Explain the relevance of personal interests and perspectives, civic virtues, and democratic principles when people address issues and problems in government and civil society",D2.Civ.10.6-8,"Explain the relevance of personal interests and perspectives, civic virtues, and democratic principles when people address issues and problems in government and civil society",c3ss
D2.Civ,6-8,"Differentiate among procedures for making decisions in the classroom, school, civil society, and local, state, and national government in terms of how civic purposes are intended",D2.Civ.11.6-8,"Differentiate among procedures for making decisions in the classroom, school, civil society, and local, state, and national government in terms of how civic purposes are intended",c3ss
D2.Civ,6-8,Assess specific rules and laws (both actual and proposed) as means of addressing public problems.,D2.Civ.12.6-8,Assess specific rules and laws (both actual and proposed) as means of addressing public problems.,c3ss
D2.Civ,6-8,"Analyze the purposes, implementation, and consequences of public policies in multiple settings",D2.Civ.13.6-8,"Analyze the purposes, implementation, and consequences of public policies in multiple settings",c3ss
D2.Civ,6-8,"Compare historical and contemporary means of changing societies, and promoting the common good.",D2.Civ.14.6-8,"Compare historical and contemporary means of changing societies, and promoting the common good.",c3ss
D2.Civ,6-8,"Explain specific roles played by citizens (such as voters, jurors, taxpayers, members of the armed forces, petitioners, protesters, and office-holders).",D2.Civ.2.6-8,"Explain specific roles played by citizens (such as voters, jurors, taxpayers, members of the armed forces, petitioners, protesters, and office-holders).",c3ss
D2.Civ,6-8,"Examine the origins, purposes, and impact of constitutions, laws, treaties, and international agreements.",D2.Civ.3.6-8,"Examine the origins, purposes, and impact of constitutions, laws, treaties, and international agreements.",c3ss
D2.Civ,6-8,"Explain the powers and limits of the three branches of government, public officials, and bureaucracies at different levels in the United States and in other countries.",D2.Civ.4.6-8,"Explain the powers and limits of the three branches of government, public officials, and bureaucracies at different levels in the United States and in other countries.",c3ss
D2.Civ,6-8,"Explain the origins, functions, and structure of government with reference to the U.S. Constitution, state constitutions, and selected other systems of government",D2.Civ.5.6-8,"Explain the origins, functions, and structure of government with reference to the U.S. Constitution, state constitutions, and selected other systems of government",c3ss
D2.Civ,6-8,"Describe the roles of political, civil, and economic organizations in shaping people’s lives.",D2.Civ.6.6-8,"Describe the roles of political, civil, and economic organizations in shaping people’s lives.",c3ss
D2.Civ,6-8,Apply civic virtues and democratic principles in school and community settings.,D2.Civ.7.6-8,Apply civic virtues and democratic principles in school and community settings.,c3ss
D2.Civ,6-8,"Analyze ideas and principles contained in the founding documents of the United States, and explain how they influence the social and political system.",D2.Civ.8.6-8,"Analyze ideas and principles contained in the founding documents of the United States, and explain how they influence the social and political system.",c3ss
D2.Civ,6-8,Compare deliberative processes used by a wide variety of groups in various settings,D2.Civ.9.6-8,Compare deliberative processes used by a wide variety of groups in various settings,c3ss
D2.Eco,6-8,"Explain how economic decisions affect the well-being of individuals, businesses, and society",D2.Eco.1.6-8,"Explain how economic decisions affect the well-being of individuals, businesses, and society",c3ss
D2.Eco,6-8, Explain the influence of changes in interest rates on borrowing and investing.,D2.Eco.10.6-8, Explain the influence of changes in interest rates on borrowing and investing.,c3ss
D2.Eco,6-8,"Use appropriate data to evaluate the state of employment, unemployment, inflation, total production, income, and economic growth in the economy.",D2.Eco.11.6-8,"Use appropriate data to evaluate the state of employment, unemployment, inflation, total production, income, and economic growth in the economy.",c3ss
D2.Eco,6-8,"Explain how inflation, deflation, and unemployment affect different groups.",D2.Eco.12.6-8,"Explain how inflation, deflation, and unemployment affect different groups.",c3ss
D2.Eco,6-8,Explain why standards of living increase as productivity improves.,D2.Eco.13.6-8,Explain why standards of living increase as productivity improves.,c3ss
D2.Eco,6-8,Explain barriers to trade and how those barriers influence trade among nations,D2.Eco.14.6-8,Explain barriers to trade and how those barriers influence trade among nations,c3ss
D2.Eco,6-8,"Explain the benefits and the costs of trade policies to individuals, businesses, and society.",D2.Eco.15.6-8,"Explain the benefits and the costs of trade policies to individuals, businesses, and society.",c3ss
D2.Eco,6-8,Evaluate alternative approaches or solutions to current economic issues in terms of benefits and costs for different groups and society as a whole.,D2.Eco.2.6-8,Evaluate alternative approaches or solutions to current economic issues in terms of benefits and costs for different groups and society as a whole.,c3ss
D2.Eco,6-8,"Explain the roles of buyers and sellers in product, labor, and financial markets.",D2.Eco.3.6-8,"Explain the roles of buyers and sellers in product, labor, and financial markets.",c3ss
D2.Eco,6-8,Describe the role of competition in the determination of prices and wages in a market economy,D2.Eco.4.6-8,Describe the role of competition in the determination of prices and wages in a market economy,c3ss
D2.Eco,6-8,Explain ways in which money facilitates exchange by reducing transactional costs,D2.Eco.5.6-8,Explain ways in which money facilitates exchange by reducing transactional costs,c3ss
D2.Eco,6-8,"Explain how changes in supply and demand cause changes in prices and quantities of goods and services, labor, credit, and foreign currencies.",D2.Eco.6.6-8,"Explain how changes in supply and demand cause changes in prices and quantities of goods and services, labor, credit, and foreign currencies.",c3ss
D2.Eco,6-8,Analyze the role of innovation and entrepreneurship in a market economy.,D2.Eco.7.6-8,Analyze the role of innovation and entrepreneurship in a market economy.,c3ss
D2.Eco,6-8,Explain how external benefits and costs influence market outcomes.,D2.Eco.8.6-8,Explain how external benefits and costs influence market outcomes.,c3ss
D2.Eco,6-8,"Describe the roles of institutions such as corporations, non-profits, and labor unions in a market economy",D2.Eco.9.6-8,"Describe the roles of institutions such as corporations, non-profits, and labor unions in a market economy",c3ss
D2.Geo,6-8,Construct maps to represent and explain the spatial patterns of cultural and environmental characteristics.,D2.Geo.1.6-8,Construct maps to represent and explain the spatial patterns of cultural and environmental characteristics.,c3ss
D2.Geo,6-8, Analyze the ways in which cultural and environmental characteristics vary among various regions of the world.,D2.Geo.10.6-8, Analyze the ways in which cultural and environmental characteristics vary among various regions of the world.,c3ss
D2.Geo,6-8, Explain how the relationship between the environmental characteristics of places and production of goods influences the spatial patterns of world trade.,D2.Geo.11.6-8, Explain how the relationship between the environmental characteristics of places and production of goods influences the spatial patterns of world trade.,c3ss
D2.Geo,6-8, Explain how global changes in population distribution patterns affect changes in land use in particular places.,D2.Geo.12.6-8, Explain how global changes in population distribution patterns affect changes in land use in particular places.,c3ss
D2.Geo,6-8,"Use maps, satellite images, photographs, and other representations to explain relationships between the locations of places and regions, and changes in their environmental characteristics.",D2.Geo.2.6-8,"Use maps, satellite images, photographs, and other representations to explain relationships between the locations of places and regions, and changes in their environmental characteristics.",c3ss
D2.Geo,6-8,Use paper based and electronic mapping and graphing techniques to represent and analyze spatial patterns of different environmental and cultural characteristics.,D2.Geo.3.6-8,Use paper based and electronic mapping and graphing techniques to represent and analyze spatial patterns of different environmental and cultural characteristics.,c3ss
D2.Geo,6-8,Explain how cultural patterns and economic decisions influence environments and the daily lives of people in both nearby and distant places.,D2.Geo.4.6-8,Explain how cultural patterns and economic decisions influence environments and the daily lives of people in both nearby and distant places.,c3ss
D2.Geo,6-8,Analyze the combinations of cultural and environmental characteristics that make places both similar to and different from other places.,D2.Geo.5.6-8,Analyze the combinations of cultural and environmental characteristics that make places both similar to and different from other places.,c3ss
D2.Geo,6-8,Explain how the physical and human characteristics of places and regions are connected to human identities and cultures.,D2.Geo.6.6-8,Explain how the physical and human characteristics of places and regions are connected to human identities and cultures.,c3ss
D2.Geo,6-8,Explain how changes in transportation and communication technology influence the spatial connections among human settlements and affect the diffusion of ideas and cultural practices.,D2.Geo.7.6-8,Explain how changes in transportation and communication technology influence the spatial connections among human settlements and affect the diffusion of ideas and cultural practices.,c3ss
D2.Geo,6-8,Analyze how relationships between humans and environments extend or contract spatial patterns of settlement and movement.,D2.Geo.8.6-8,Analyze how relationships between humans and environments extend or contract spatial patterns of settlement and movement.,c3ss
D2.Geo,6-8,Evaluate the influences of long-term human-induced environmental change on spatial patterns of conflict and cooperation.,D2.Geo.9.6-8,Evaluate the influences of long-term human-induced environmental change on spatial patterns of conflict and cooperation.,c3ss
D2.His,6-8,Analyze connections among events and developments in broader historical contexts.,D2.His.1.6-8,Analyze connections among events and developments in broader historical contexts.,c3ss
D2.His,6-8,Detect possible limitations in the historical record based on evidence collected from different kinds of historical sources.,D2.His.10.6-8,Detect possible limitations in the historical record based on evidence collected from different kinds of historical sources.,c3ss
D2.His,6-8,"Use other historical sources to infer a plausible maker, date, place of origin, and intended audience for historical sources where this information is not easily identified.",D2.His.11.6-8,"Use other historical sources to infer a plausible maker, date, place of origin, and intended audience for historical sources where this information is not easily identified.",c3ss
D2.His,6-8,Use questions generated about multiple historical sources to identify further areas of inquiry and additional sources.,D2.His.12.6-8,Use questions generated about multiple historical sources to identify further areas of inquiry and additional sources.,c3ss
D2.His,6-8,"Evaluate the relevancy and utility of a historical source based on information such as maker, date, place of origin, intended audience, and purpose.",D2.His.13.6-8,"Evaluate the relevancy and utility of a historical source based on information such as maker, date, place of origin, intended audience, and purpose.",c3ss
D2.His,6-8,Explain multiple causes and effects of events and developments in the past.,D2.His.14.6-8,Explain multiple causes and effects of events and developments in the past.,c3ss
D2.His,6-8,Evaluate the relative influence of various causes of events and developments in the past.,D2.His.15.6-8,Evaluate the relative influence of various causes of events and developments in the past.,c3ss
D2.His,6-8, Organize applicable evidence into a coherent argument about the past.,D2.His.16.6-8, Organize applicable evidence into a coherent argument about the past.,c3ss
D2.His,6-8, Compare the central arguments in secondary works of history on related topics in multiple media.,D2.His.17.6-8, Compare the central arguments in secondary works of history on related topics in multiple media.,c3ss
D2.His,6-8,Classify series of historical events and developments as examples of change and/or continuity.,D2.His.2.6-8,Classify series of historical events and developments as examples of change and/or continuity.,c3ss
D2.His,6-8,"Use questions generated about individuals and groups to analyze why they, and the developments they shaped, are seen as historically significant.",D2.His.3.6-8,"Use questions generated about individuals and groups to analyze why they, and the developments they shaped, are seen as historically significant.",c3ss
D2.His,6-8,Analyze multiple factors that influenced the perspectives of people during different historical eras.,D2.His.4.6-8,Analyze multiple factors that influenced the perspectives of people during different historical eras.,c3ss
D2.His,6-8,Explain how and why perspectives of people have changed over time.,D2.His.5.6-8,Explain how and why perspectives of people have changed over time.,c3ss
D2.His,6-8,Analyze how people’s perspectives influenced what information is available in the historical sources they created.,D2.His.6.6-8,Analyze how people’s perspectives influenced what information is available in the historical sources they created.,c3ss
D2.His,6-8,Classify the kinds of historical sources used in a secondary interpretation.,D2.His.9.6-8,Classify the kinds of historical sources used in a secondary interpretation.,c3ss
D3.Sources,6-8,"Gather relevant information from multiple sources while using the origin, authority, structure, context, and corroborative value of the sources to guide the selection.",D3.1.6-8,"Gather relevant information from multiple sources while using the origin, authority, structure, context, and corroborative value of the sources to guide the selection.",c3ss
D3.Sources,6-8,Evaluate the credibility of a source by determining its relevance and intended use.,D3.2.6-8,Evaluate the credibility of a source by determining its relevance and intended use.,c3ss
D3.Claims,6-8,"Identify evidence that draws information from multiple sources to support claims, noting evidentiary limitations.",D3.3.6-8,"Identify evidence that draws information from multiple sources to support claims, noting evidentiary limitations.",c3ss
D3.Claims,6-8,Develop claims and counterclaims while pointing out the strengths and limitations of both.,D3.4.6-8,Develop claims and counterclaims while pointing out the strengths and limitations of both.,c3ss
D4.Conclusions,6-8,"Construct arguments using claims and evidence from multiple sources, while acknowledging the strengths and limitations of the arguments.",D4.1.6-8,"Construct arguments using claims and evidence from multiple sources, while acknowledging the strengths and limitations of the arguments.",c3ss
D4.Conclusions,6-8,"Construct explanations using reasoning, correct sequence, examples, and details with relevant information and data, while acknowledging the strengths and weaknesses of the explanations",D4.2.6-8,"Construct explanations using reasoning, correct sequence, examples, and details with relevant information and data, while acknowledging the strengths and weaknesses of the explanations",c3ss
D4.Conclusions,6-8,"Present adaptations of arguments and explanations on topics of interest to others to reach audiences and venues outside the classroom using print and oral technologies (e.g., posters, essays, letters, debates, speeches, reports, and maps) and digital technologies (e.g., Internet, social media, and digital documentary).",D4.3.6-8,"Present adaptations of arguments and explanations on topics of interest to others to reach audiences and venues outside the classroom using print and oral technologies (e.g., posters, essays, letters, debates, speeches, reports, and maps) and digital technologies (e.g., Internet, social media, and digital documentary).",c3ss
D4.Conclusions,6-8,Critique arguments for credibility,D4.4.6-8,Critique arguments for credibility,c3ss
D4.Conclusions,6-8,Critique the structure of explanations.,D4.5.6-8,Critique the structure of explanations.,c3ss
D4.Action,6-8,"Draw on multiple disciplinary lenses to analyze how a specific problem can manifest itself at local, regional, and global levels over time, identifying its characteristics and causes, and the challenges and opportunities faced by those trying to address the problem.",D4.6.6-8,"Draw on multiple disciplinary lenses to analyze how a specific problem can manifest itself at local, regional, and global levels over time, identifying its characteristics and causes, and the challenges and opportunities faced by those trying to address the problem.",c3ss
D4.Action,6-8,"Assess their individual and collective capacities to take action to address local, regional, and global problems, taking into account a range of possible levers of power, strategies, and potential outcomes.",D4.7.6-8,"Assess their individual and collective capacities to take action to address local, regional, and global problems, taking into account a range of possible levers of power, strategies, and potential outcomes.",c3ss
D4.Action,6-8,"Apply a range of deliberative and democratic procedures to make decisions and take action in their classrooms and schools, and in out-of-school civic contexts.",D4.8.6-8,"Apply a range of deliberative and democratic procedures to make decisions and take action in their classrooms and schools, and in out-of-school civic contexts.",c3ss
D1,6-8,Explain how a question reflects an enduring issue in the field.,D1.1.9-12,Explain how a question reflects an enduring issue in the field.,c3ss
D1,6-8,Explain points of agreement and disagreement experts have about interpretations and applications of disciplinary concepts and ideas associated with a supporting question.,D1.3.9-12,Explain points of agreement and disagreement experts have about interpretations and applications of disciplinary concepts and ideas associated with a supporting question.,c3ss
D1,6-8,"Determine the kinds of sources that will be helpful in answering compelling and supporting questions, taking into consideration multiple points of view represented in the sources, the types of sources available, and the potential uses of the sources.",D1.5.9-12,"Determine the kinds of sources that will be helpful in answering compelling and supporting questions, taking into consideration multiple points of view represented in the sources, the types of sources available, and the potential uses of the sources.",c3ss
D1,6-8,Explain points of agreement and disagreement experts have about interpretations and applications of disciplinary concepts and ideas associated with a compelling question.,D1.2.9-12,Explain points of agreement and disagreement experts have about interpretations and applications of disciplinary concepts and ideas associated with a compelling question.,c3ss
D1,6-8,"Explain how supporting questions contribute to an inquiry and how, through engaging source work, new compelling and supporting questions emerge",D1.4.9-12,"Explain how supporting questions contribute to an inquiry and how, through engaging source work, new compelling and supporting questions emerge",c3ss
D2.Civ,6-8,"Distinguish the powers and responsibilities of local, state, tribal, national, and international civic and political institutions.",D2.Civ.1.9-12,"Distinguish the powers and responsibilities of local, state, tribal, national, and international civic and political institutions.",c3ss
D2.Civ,6-8,"Analyze the impact and the appropriate roles of personal interests and perspectives on the application of civic virtues, democratic principles, constitutional rights, and human rights.",D2.Civ.10.9-12,"Analyze the impact and the appropriate roles of personal interests and perspectives on the application of civic virtues, democratic principles, constitutional rights, and human rights.",c3ss
D2.Civ,6-8,"Evaluate multiple procedures for making governmental decisions at the local, state, national, and international levels in terms of the civic purposes achieved.",D2.Civ.11.9-12,"Evaluate multiple procedures for making governmental decisions at the local, state, national, and international levels in terms of the civic purposes achieved.",c3ss
D2.Civ,6-8,"Analyze how people use and challenge local, state, national, and international laws to address a variety of public issues.",D2.Civ.12.9-12,"Analyze how people use and challenge local, state, national, and international laws to address a variety of public issues.",c3ss
