displayweight_i,code_s,name_s,orgname_s,url_s,shortdescription_s,longdescription_t,platformtext_s,gradelevel_s,image_s,tags_s,teachers_notes_s,language_s,languages_supported_s,short_code_s
80,lego_beyond,LEGO® MINDSTORMS® Education EV3,LEGO Education,https://education.lego.com,Build and program a robot,Build and code with the ultimate playful learning experience. The endless flexibility of LEGO bricks and the open-ended nature of our curriculum and coding software allows students to explore and develop their ideas as far as their curiosity will take them. We empower teachers with the tools for creating and delivering the most engaging lessons in STEM for every student.,Robot purchase,Middle school +,/images/lego.jpeg,"Robot,RobotsElem",,,,
70,kinderlab_beyond,KIBO,KinderLab Robotics,http://kinderlabrobotics.com/,"Kids build their own robot, program it with wooden blocks, and decorate it with arts and crafts materials","Kids build their own robot with KIBO, program it using wooden blocks, and decorate it with arts and crafts materials - all without a PC, tablet, or smartphone. KIBO invites playful learning and children's creativity and imagination. Curriculum for schools, activities for the home, design journals and workbooks are also available. ",Robot purchase,Ages 4 to 7,/images/kinderlab.png,"Robot,Prereader,RobotsElem",,,,
60,tickle_beyond,Tickle,Tickle Labs,http://tickleapp.com/,"Program drones, robots, and Arduino, wirelessly","Experience the magic of programming drones, robots, smart homes, and Arduino, all wirelessly! Tickle is easy to learn, fun to use, yet powerful enough for university courses and research projects. You can program a variety of drones and robots to fly, take photos, and navigate through mazes. You can even create custom robots by adding Arduino-based sensors and motors.",iPad,Ages 6+,/images/tickle.png,"Robot,RobotsElem,RobotsMid",,,,
55,kanoelem_beyond,Creative Coding with Kano,Kano Computing ,https://world.kano.me/projects,"Curious minds of all abilities can create art, games, music and more! Follow guided challenges, remix what others have made, and make original creations from scratch. Hours of challenges available with blocks or simple syntax-based coding languages.","Curious minds of all abilities can create art, games, music and more! Follow guided challenges, remix what others have made, and make original creations from scratch. Hours of challenges available with blocks or simple syntax-based coding languages.",Modern web browsers,Elementary +,/images/tutorials/beyond/kanoelem.png,RobotsElem,,,,
52,kanomid_beyond,"Build Computers, Create with Code",Kano,http://kano.me/educators,"Kano's hardware kits, learn-to-code platform, and full curriculum support bring coding to life in the physical world. Build computers, visualize music with exciting pixel light displays, and make games that respond to motion.","Kano is the best solution for demystifying technology whether at home or at school - with exciting hardware kits, an engaging and intuitive learn-to-code platform, and full curriculum support. Kano kits bring coding to life in the physical world - build computers, visualize music with exciting pixel light displays, and make games that respond to motion.",Modern web browsers; Robot purchase,Elementary +,/images/tutorials/beyond/kanomid.png,RobotsMid,,,,
50,sphero_beyond,Sphero SPRK+,Sphero Edu,http://www.sphero.com/education,SPRK lessons give kids a fun crash course in programming robots while sharpening skills in math and science.,"Designed to inspire curiosity, creativity, and invention through connected play and coding, SPRK+ is far more than just a robot. Powered by the Sphero Edu app, you can easily learn programming, complete hands-on activities, and share your creations with the community. Learning is evolving. Get on the ball.",Robot purchase,Ages 8+,/images/sphero.png,"Robot,RobotsElem,RobotsMid",,,,
40,ozobot_beyond,Ozobot,Ozobot,https://ozobot.com/educate/lessons,Ozobot is the tiny robot that makes coding fun and easy with extensive resources for grades K-12.,"Ozobot is the tiny robot that makes coding and computer science fun and easy to learn. Choose from a wide variety of STEM lessons and activities ranging from kindergarten to high school grade levels. Whether your students are novices or experts, Ozobot will keep them engaged for hours of learning and fun. Not an experienced programmer yourself? Not a problem! Simple instruction guides, how-to videos and introductory lessons will make you an Ozobot expert in no time!",Modern web browsers,All ages,/images/ozobot.jpg,"Robot,RobotsElem,RobotsMid",,,,
30,finch_beyond,Finch Robot and Hummingbird Robotics Kit,BirdBrain Technologies,http://www.finchrobot.com/,Both the Finch Robot and the Hummingbird Robotics Kit empower students to take ownership of their technical and creative skill sets and engage in flexible problem-solving activities.,"The Finch Robot makes coding tangible in many programming languages ranging from Kindergarten to College-level computer science. The Hummingbird Robotics Kit is comprised of lights, sensors and motors, allowing students to build a robot out of any materials. Both of these products empower students to take ownership of their technical and creative skill sets and engage in flexible problem-solving activities.",Robot purchase,Ages 8+,/images/finch.png,"Robot,RobotsElem,RobotsMid",,,,
6,botley_beyond,Screen-free Coding with Botley™ the Coding Robot,Learning Resources,https://www.learningresources.com/text/botley/index.html,Never coded before? No problem! Botley™ the Coding Robot is ready to use right out of the box and will have you coding in minutes.,"Never coded before? No problem! Botley™ the Coding Robot is ready to use right out of the box and will have you coding in minutes. Botley can be introduced to children as young as 5, and with advanced features, can grow with them as well. Botley is completely screen free – no phone or tablet required. Code Botley up to 120 steps, loop him and program him to go around objects with if/then logic. Botley can follow black lines, too – and even has hidden features to unlock!",Robot purchase,Ages 5-10,/images/tutorials/beyond/botley.jpg,"Robot,RobotsElem",,,,
3,processing_beyond,Program with Processing,Processing,http://processing.org/,Learn the Processing languages,"Processing is a programming language, development environment, and online community. Since 2001, Processing has promoted software literacy within the visual arts and visual literacy within technology. Initially created to serve as a software sketchbook and to teach computer programming fundamentals within a visual context, Processing evolved into a development tool for professionals. Today, there are tens of thousands of students, artists, designers, researchers, and hobbyists who use Processing for learning, prototyping, and production.",Modern web browsers,High school,/images/processing.png,IDE,,,,
2,alice_beyond,Alice,The Alice Project,http://www.alice.org/resources/lessons/hour-of-code-2/,Teach programming in a 3D environment,"Using an innovative programming environment to support the creation of 3D animations, the Alice Project provides tools and materials for teaching and learning computational thinking, problem solving, and computer programming across a spectrum of ages and grade levels.",Windows or Mac (install required),Middle school +,/images/alice.png,IDE,,,,
