district_s,state_s
Montgomery Public Schools,Alabama
Yukon Flats School District,Alaska
Paradise Valley Unified School District,Arizona
Deer Valley Public School District,Arizona
Shasta Union High School,California
Fort Bragg Unified School District,California
Los Angeles Unified School District,California
Garden Grove Unified School District,California
Pueblo School District 60,Colorado
Consolidated School District of New Britain,Connecticut
Hartford Public Schools,Connecticut
Hawaii State Department of Education,Hawaii
Grayslake CCSD 46,Illinois
Carlinville Community Unit School District #1,Illinois
Center Grove Community Schools,Indiana
Jennings County School District,Indiana
Holy Family Catholic Schools,Iowa
Dubuque Community School District,Iowa
Mid-Prairie Community School District,Iowa
Wichita Public Schools,Kansas
Daviess County School District,Kentucky
Discovery Schools,Louisanna
National Heritage Academies,Michigan
Detroit Public Schools,Michigan
Chippewa Valley Schools,Michigan
Notre Dame Preparatory School,Michigan
Nicollet Public 507,Minnesota
Brooklyn Center Community Schools,Minnesota
Clark County School District,Nevada
Nye County School District,Nevada
Lyon County School District,Nevada
Elko County School District,Nevada
Somerville Public Schools,New Jersey
Newark Public School District,New Jersey
St. Lawrence-Lewis BOCES,New York
Evans-Brant Central School District,New York
Highland Falls Central District,New York
Currituck County Schools,North Carolina
North Carolina Telra Institute,North Carolina
Horizon Science Academy Cleveland High School,Ohio
Norwin School District,Pennsylvania
Robertson County School District,Tennessee
Southside Independent School District,Texas
Raleigh County School District,West Virginia
Fayette County Schools,West Virginia	
Yavneh Academy,New Jersey
Osage Community Schools,Iowa
Humboldt County School District,Nevada
ColumbusCounty Schools,North Carolina
Wilson County Schools,Tennessee
Calvary Academy,Illinois
