heading_s,short_heading_s,image_url_s,link_text_s,url_s,date_s,publication_s,tag_s*,site_s*
,,,,,,,,
,,,,,,,,
,,,,,,,,
,,,,,,,,
,,,,,,,,
,,,,,,,,
,,,,,,,,
Code.org takes computer science into middle schools,,,,http://www.seattletimes.com/business/technology/codeorg-takes-computer-science-into-middle-schools/ ,6/26/2017,Seattle Times,news,code.org
GM CEO Mary Barra says the world needs more coders,,,,http://money.cnn.com/2017/06/28/technology/gm-engineer-training/index.html,6/28/2017,CNN,news,code.org
Iowa passes bill to require all schools teach computer science,,,,https://medium.com/@codeorg/iowa-passes-bill-to-bring-computer-science-to-every-school-fcfc94753325,5/1/2017,Code.org,announce,all
States gather to go from an Hour of Code to years of computer science education,,,,http://blog.code.org/post/154426322258/states-gather-to-go-from-an-hour-of-code-to-years,12/13/2016,Code.org,announce,all
Celebrating Computer Science Education Week 2016: Investing in Computer Science for All Will Be Key to College and Career Readiness,,,,http://www.huffingtonpost.com/jd-hoye/celebrating-computer-scie_b_13371386.html,12/5/2016,Huffington Post,news,all
"Code.org Brings in Serena Williams, Draymond Green to Promote Sports-Themed 'Hour of Code'",,,,https://www.edsurge.com/news/2016-12-05-code-org-brings-in-serena-williams-draymond-green-to-promote-sports-themed-coding,12/5/2016,EdSurge,news,all
Do an Hour of Code with Disney’s Moana!,,,,http://blog.code.org/post/153520284258/do-an-hour-of-code-with-disneys-moana,11/22/2016,Code.org,announce,all
A Plan to Teach Every Child Computer Science,,,,https://www.theatlantic.com/education/archive/2016/10/a-plan-to-teach-every-child-computer-science/504587/,10/18/2016,The Atlantic,news,all
"Introducing the K–12 Computer Science Framework, a milestone for CS education",,,,http://blog.code.org/post/151935557103/introducing-the-k12-computer-science-framework-a,10/17/2016,Code.org,announce,all
Students who learn computer science in high school are 6x more likely to major in it.,,,,http://blog.code.org/post/143007230537/computer-science-the-impact-of-k-12-on-university,4/18/2016,Code.org,announce,all
Idaho funds $2M expansion of computer science in K-12 schools!,,,,http://blog.code.org/post/141573755948/idaho-funds-expansion-of-computer-science,3/23/2016,Code.org,announce,all
Virginia is adding computer science to every K-12 school,,,,http://blog.code.org/post/140706453533/virginia-is-adding-computer-science-to-every-k-12,3/8/2016,Code.org,announce,all
Rhode Island announces a plan to teach every student computer science,,,,http://blog.code.org/post/140641272123/rhode-island-announces-a-plan-to-teach-every,3/7/2016,Code.org,announce,all
Governors form new partnership to expand computer science education,,,,http://blog.code.org/post/139741779673/governors-form-new-partnership-to-expand-computer,2/21/2016,Code.org,announce,all
Re/code Decode interview: Code.org CEO Hadi Partovi,,,,http://recode.net/2016/02/15/code-org-ceo-hadi-partovi-says-young-people-should-study-computer-science-even-if-they-wont-become-programmers/,2/15/2016,Re/code,news,code.org
The White House announces plans to bring computer science to every student,,,,http://blog.code.org/post/138335868703/the-white-house-announces-plans-to-bring-computer,1/30/2016,Code.org,announce,code.org
"Infosys Foundation Chairperson and Code.org Board Member Vandana Sikka helps students from Bronx, NY complete their Hour of Code tutorial at the Hour of Code Kickoff Pep Rally",Pair programming in action,/images/highlights/kickoff-vandana.jpg,,,,,,
Students from ,Students share their learn-to-code journeys,/images/highlights/kickoff-student-panel.jpg,,,,,,
"The Hour of Code 2015 kicks off with a pep rally in New York City, hosted by Code.org, Microsoft, and Google (with a very special appearance by R2-D2 from Star Wars and more) ",Hour of Code 2015 kicks off,/images/highlights/kickoff-certificates.jpg,,,12/7/2015,,highlight,hourofcode.com
,,,,,,,,
"US law adds computer science to ""well-rounded education"" subjects",,,,http://blog.code.org/post/134932134563/sweeping-us-education-law-adds-computer-science,12/10/2015,Code.org,announce,all
Apple hosts the Hour of Code worldwide,,,,http://blog.code.org/post/134402435298/apple-hosts-the-hour-of-code-worldwide,12/2/2015,Code.org,announce,all
"Google celebrates the Hour of Code 2013 with this tribute to Grace Hopper, one of the very first computer programmers.",Hour of Code Google Doodle,/images/highlights/google-doodle.png,See on Twitter,https://twitter.com/codeorg/status/410054065737854976,12/9/2013,Google,highlight,hourofcode.com
"Code.org, Disney and Star Wars launch Hour of Code ""build-your-own-game"" tutorial to broaden computer science participation",,,,http://code.org/star-wars-announcement,11/9/2015,Code.org,announce,code.org
Computer science is finally included in “STEM”,,,,http://blog.code.org/post/130358071518/computer-science-is-finally-included-in-stem,10/2/2015,Code.org,announce,all
43% of coders are girls (and a lot more),,,,http://blog.code.org/post/124017777158/mid-2015-update,7/13/2015,Code.org,announce,code.org
College Board and Code.org form an alliance to improve diversity in computer science,,,,http://code.org/college-board,5/14/2015,Code.org,announce,all
Why coding is your child’s key to unlocking the future,,,,http://www.wsj.com/articles/why-coding-is-your-childs-key-to-unlocking-the-future-1430080118,4/26/2015,Wall Street Journal,news,all
"With education moving online, do we even need teachers anymore?… YES!",,,,http://codeorg.tumblr.com/post/109309459413/teacher-online,1/27/2015,Code.org,announce,all
Hadi Partovi: Computer Science is foundational,,,,https://www.youtube.com/watch?v=m-U9wzC9xLk,12/10/2014,TEDxRainier,news,all
President Obama kicks off the Hour of Code 2014 ,,,,http://youtu.be/JDw1ii7aKwg,12/8/2014,Code.org,announce,all
"In partnership with Fox, Code.org adds Ice Age's Scrat to tutorial lineup",,,,http://codeorg.tumblr.com/post/103557585923/scrat,11/25/2014,Code.org,announce,code.org
Code.org breaks Indiegogo fundraising record as it reaches halfway point,,,,http://www.fastcompany.com/3038067/codeorg-breaks-indiegogo-fundraising-record-as-it-reaches-halfway-point,11/4/2014,Fast Company,news,code.org
Sweeping nationwide change: 14 states in 15 months change policies to support computer science,,,,http://codeorg.tumblr.com/post/98827213703/makecscount,9/30/2014,Code.org,announce,code.org
Code.org launches Code Studio - a new online learning platform,,,,http://codeorg.tumblr.com/post/97219291088/announcing-code-studio,9/11/2014,Code.org,announce,code.org
Seeing our impact: A record year for computer science,,,,http://codeorg.tumblr.com/post/91961669383/ap-computer-science,7/16/2014,Code.org,announce,all
Vice President Joe Biden urges governors to work with Code.org,,,,https://www.youtube.com/watch?v=aaYk_nt4kVo,7/14/2014,Code.org,announce,all
"Reading, writing, arithmetic, and now, coding",,,,http://www.nytimes.com/2014/05/11/us/reading-writing-arithmetic-and-lately-coding.html,5/11/2014,New York Times,news,all
Computer science is not a foreign language. Here's why.,,,,http://codeorg.tumblr.com/post/75129943201/language,1/31/2014,Code.org,announce,all
"The ""secret agenda"" behind Code.org - A response to critics",,,,http://codeorg.tumblr.com/post/73963049605/the-secret-agenda-of-code-org,1/20/2014,Code.org,announce,code.org
Code.org's incredible first year,,,,http://codeorg.tumblr.com/post/73414288834/2013update,1/15/2014,Code.org,announce,all
The real reason there aren't more women in tech,,,,http://codeorg.tumblr.com/post/71933359496/women,1/2/2014,Code.org,announce,code.org
The Hour of Code reaches 10 million students,,,,http://codeorg.tumblr.com/post/69791914096/10million,12/12/2013,Code.org,announce,all
Why aren't schools teaching more computer science?,,,,http://www.bloomberg.com/video/why-aren-t-schools-teaching-more-computer-science-7~Oa7vyrS5S03L_KZWFuYA.html,12/9/2013,Bloomberg,news,all
Code.org video is #20 most shared ad of 2013,,,,http://econsultancy.com/us/blog/63840-top-20-most-shared-video-ads-of-2013,11/21/2013,Econsultancy,news,code.org
One million students. One Hour of Code.,,,,http://codeorg.tumblr.com/post/65627743187/only-16-days-after-we-announced-the-hour-of-code,10/31/2013,Code.org,announce,all
"Code.org introduces ""Hour of Code"" campaign to inspire 10 million students to learn to code",,,,http://code.org/hourofcode,10/14/2013,Code.org,announce,all
Code.org Launches To Help Make Computer Programming Accessible To Everyone,,,,http://techcrunch.com/2013/01/22/code-org-launches-to-help-make-computer-programming-accessible-to-everyone/,2/28/2013,Tech Crunch,news,code.org
Hadi and Ali Partovi (Code.org's twin co-founders) AMA on Reddit,,,,http://www.reddit.com/r/IAmA/comments/19eqzm/iam_hadi_partovi_cofounder_of_codeorg_here_with/,2/26/2013,Reddit,news,code.org
"Code.Org Short Film With Bill Gates, Mark Zuckerberg, will.i.am, and Chris Bosh Gets Over 12 Million Views, Tops YouTube List",,,,http://code.org/news/12-million-youtube-views,3/12/2013,Code.org,announce,code.org
Nevada passes bill to bring computer science to every school!,,,,https://medium.com/@codeorg/nevada-passes-bill-to-bring-computer-science-to-every-school-ed2d3b7224cd,6/16/2017,Code.org,announce,code.org
#APCSP is here!,,,,https://medium.com/@codeorg/apcsp-is-here-91699b48b10f,5/3/2017,Code.org,announce,code.org
