displayweight,code,name,orgname,contact,url,shortdescription,longdescription,platformtext,gradelevel,image,tags,teachers_notes,language,languages_supported,short_code,name_ro,gradelevel_ro,platformtext_ro,shortdescription_ro,longdescription_ro,name_pt,gradelevel_pt,platformtext_pt,shortdescription_pt,longdescription_pt
2000,blockly,Blockly,Google Education,spertus@google.com,https://github.com/google/blockly-games/wiki/Offline,Download a ZIP file to learn offline,Got PCs with slow (or non-existent) internet access? Download the Blockly tutorials that were the precursor of the Code.org tutorials - a single 3MB ZIP file can be loaded onto any computer or used off a memory stick,Modern browsers only,All ages,/images/blockly.png,"Unplugged,International",,"Spanish, French, many others","ar,br,ca,cs,da,de,el,en,es,eu,fa,fr,gl,hu,ia,is,it,ko,lv,mk,ms,nl,pl,pms,pt-br,ro,ru,sk,sr,sv,sw,th,tr,uk,vi,zh-hans,zh-hant,zh-tw,zh-cn",bl,Blockly,Toate vârstele,Browsere web moderne,Descarcă arhiva ZIP ca să înveți offline,Ai un calculator fără internet sau cu internet cu viteză mică? Descarcă tutorialele Blockly care sunt precursoarele tutorialelor Code.org - un fișier arhivat de 3MB poate fi încărcat de pe computer sau de pe un stick USB.,Blockly,Todas as idades,Navegadores Web modernos,Baixe um arquivo ZIP para aprender offline,"Você tem um PC com conexão à Internet lenta (ou inexistente)? Baixe os tutoriais Blockly, que são os precursores dos tutoriais da Code.org - um único arquivo ZIP de 3MB que pode ser carregado em qualquer computador ou usado em um cartão de memória"
1500,thinkersmith2,Binary Baubles,Thinkersmith,info@thinkermith.org,/files/CSEDbinary.pdf,Learn how computers use 1s and 0s to represent information,"Students learn about representing and storing letters in binary, as functions of on and off. At the end, the class gets to encode their own initials to take home with them.",Unplugged,Ages 8+,/images/binarybaubles.png,"Unplugged,IE8",,,,th,Binary Baubles,Vârstă 8+,Unplugged,Învață cum folosesc computerele 1 și 0 pentru a reprezenta informația,Elevii învață despre reprezentarea și salvarea literelor în sistem binar ca funcție on si off. La final elevii pot sa decodeze propriile inițiale pentru a le lua acasă.,Mundo binário,A partir de 8 anos,Offline,Aprenda como os computadores usam 1s e 0s para representar informações,"Os alunos aprendem sobre representação e armazenamento de letras em binário, como funções que ligam e desligam. No final, a turma aprende a programar suas próprias iniciais para levá-las para casa."
1000,codehs,Learn to Code With Karel the Dog,CodeHS,jkeesh@codehs.com,http://codehs.com/hourofcode,Learn JavaScript programming with a fun visual environment,"Learn the basics of programming with Karel the Dog, a fun, accessible and visual introduction to coding, where giving commands to a computer is just like giving commands to a dog. This tutorial is great if led by a teacher, but can also be done independently.",Modern browsers,High school,/images/codehs.png,JavaScript,https://docs.google.com/a/codehs.com/document/d/1f4towRwppfVsbsmM7HjmOlXiQFV-zjTe4oXjKwu-YYM/edit,,,ch,Învață programare cu Karel câinele,Liceu,Browsere web moderne,"Învață JavaScript într-un mediu vizual, distractiv","Învață bazele programării cu Karel, câinele, o introducere distractivă și vizuală în programare, unde a da comenzi unui computer e ca și cum ai da comenzi unui câine. Acest tutorial este ideal daca este ghidat de un profesor dar poate fi realizat și individual.","Aprenda a programar com Karel, o cachorro",Ensino Médio,Navegadores Web modernos,Aprenda a programar em JavaScript com um ambiente visual divertido,"Aprenda os conceitos básicos de programação com Karel, o cachorro. Uma introdução visual divertida e acessível à programação, na qual dar comandos ao computador é o mesmo que dar comandos a um cachorro. Esse tutorial é ótimo se conduzido por um professor, mas também pode ser feito de forma individual."
900,codeavengers,Build a Game with JavaScript,Code Avengers,mike@codeavengers.com,http://codeavengers.com/javascript/17,"Learn JavaScript programming, in a web-browser",Build a 2 player 2D top-down game with JavaScript in 10 short tasks. Then continue learning some basics of programming (variables and if statements) as you create a Quiz to share with friends. Along the way  earn points and badges as you compete to reach the top of the class leaderboard.,Modern Web browsers,Middle school +,/images/codeavengers.png,JavaScript,,,,cv,Construiește un joc cu JavaScript,Gimnaziu,Browsere web moderne,Învață JavaScript într-un browser web,"Construiește în întregime un joc 2D pentru 2 jucatori, cu JavaScript, în 10 pași simpli. Apoi continua studiul unor elemente de bază ale programării (variabile și if statements) cât realizezi un Quiz pe care îl poți share-ui prietenilor. Pe tot parcursul activității caștigă puncte și insigne, concurând la ocuparea primului loc al clasamentului în clasă.",Crie um jogo com JavaScript,Ensino Fundamental II,Navegadores Web modernos,Aprenda a programar em JavaScript em um navegador Web,"Crie um jogo em 2D para 2 jogadores com JavaScript em 10 pequenas tarefas. Em seguida, continue aprendendo conceitos básicos de programação (variáveis e instruções if), criando um Quiz para compartilhar com seus amigos. No caminho, ganhe pontos e medalhas conforme você progride na aula."
800,codecombat,CodeCombat,CodeCombat,team@codecombat.com,http://codecombat.com/play/level/rescue-mission?hour_of_code=true,Play a game and learn JavaScript to win,"Play as a Wizard using code (spells) to control your heroes, navigate mazes, defeat ogres, trick enemies, and rescue allies! Learn JavaScript in this HTML 5 web game for complete beginners.","Web based (Firefox, Chrome, Safari, IE10+)",Middle school +,/images/codecombat.png,JavaScript,http://codecombat.com/teachers,,,cc,CodeCombat,Gimnaziu,"Web based (Firefox, Chrome, Safari, IE9+)",Joacă un joc și învață JavaScript să caștigi,"Joacă rolul unui Vrăjitor utilizând programarea pentru vrăji prin care controlezi eroii, navighezi prin labirinturi, învingi ogres, păcălești inamici și salvezi extratereștri! Învață JavaScript pentru începători în acest joc web în HTML 5.",CodeCombat,Ensino Fundamental II,"Baseado na Web (Firefox, Chrome, Safari, IE9+)",Jogue um jogo e aprenda JavaScript para ganhar,"Jogue como um Mago usando programação (magias) para controlar seus heróis, passar por labirintos, derrotar ogros, enganar inimigos e resgatar aliados! Aprenda JavaScript nesse jogo em HTML 5 para iniciantes disponível na Web."
700,agentcubes,Make a 3D Frogger game in an hour.,University of Colorado,minerva@agentsheets.com,http://sgda.cs.colorado.edu/arcade/?q=hour_of_code,Create a 3D game using AgentCubes Online,"Imagine a tool that allows you to turn 2D images into 3D shapes. Use AgentCubes online, the world's first 3D web-based programming & modeling tool, to learn to program by creating and sharing exciting 3D games. Rule your world!",Modern browsers,Middle school +,/images/agentcubes.png,Other,,,,ac,Construiește un joc 3D Frogger într-o oră,Gimnaziu,Browsere web moderne,Creează un joc 3D utilizând AgentCubes Online,"Imaginează-ți un instrument cere îți dă posibilitatea să transformi imagini 2D în forme 3D. Utilizează AgentCubes online, primul instrument de programare si modelare 3D web din lume, pentru a învăța să programezi creând și share-uind jocuri 3D. Fii stăpânul propriei tale lumi!",Crie um jogo Frogger 3D em uma hora,Ensino Fundamental II,Navegadores Web modernos,Crie um jogo em 3D usando AgentCubes on-line,"Imagine uma ferramenta que permite que você transforme imagens 2D em formas 3D. Use AgentCubes on-line, a primeira ferramenta de programação web e modelagem 3D do mundo, para aprender a programar criando e compartilhando jogos em 3D. Tenha domínio sobre seu próprio mundo!"
600,alice,Intro to Programming with Alice 2,Alice Project,dslater@andrew.cmu.edu,http://www.alice.org/HourOfCode/introduction.html,Make a 3D animation,Students will set up a scene and create a simple animation with minimal teacher facilitation using 3D objects and and drag-and-drop interface in an engaging and supportive coding environment. [NOTE: Desktop app install required],Windows or Mac (install required),Middle school +,/images/alice.png,Other,,,,ap,Intro în programare cu Alice 2,Gimnaziu,Windows sau Mac (instalare necesară),Creează o animație 3D,"Elevii vor stabili o scenă și vor crea o animație simplă cu minime resurse ajutătoare din partea profesorului, utilizând obiecte 3D si o interfață drag-and-drop într-un mediu de programare interactiv și suportiv. [NOTĂ: Instalare aplicație Desktop necesară]",Introdução à programação com a Alice 2,Ensino Fundamental II,Windows ou Mac (instalação obrigatória),Faça uma animação em 3D,"Os alunos vão configurar uma cena e criar uma animação simples com o mínimo de orientação do professor, usando objetos em 3D e a interface drag and drop em um ambiente de desenvolvimento divertido e envolvente. [OBSERVAÇÃO: é necessário instalar o aplicativo para Desktop]"
400,livecode,Everyone can Code with LiveCode,RunRev,steven.crighton@runrev.com mildred.foo@runrev.com ,http://livecode.com/your-hour-of-code/,Learn to code with LiveCode,"Everyone can Code with LiveCode contains 6 video lessons including an introduction to The LiveCode environment.  It will show you how to make the popular ""Sheepherder"" game featured on YouTube. Watch each short video and follow along using the step by step written documentation.  All the game code is available for you to copy and paste, with clear explanations of how and why it works. You will be provided with necessary images and samples for download. [NOTE: DESKTOP INSTALL REQUIRED] ",Windows or Mac (install required),High school,/images/runrev.jpg,Other,,,,lc,Oricine poate să programeze cu LiveCode,Liceu,Windows sau Mac (instalare necesară),Învață programare cu LiveCode,"Oricine poate să programeze cu LiveCode. Activitatea conține 6 lecții video ce includ o introducere în mediul LiveCode. Îți arată cum să creezi jocul popular ""Sheepherder"" prezentat și pe YouTube. Urmarește fiecare scurt videoclip și urmează pas cu pas instrucțiunile din documentație. Tot codul jocului este disponibil pentru copy/ paste cu explicații clare despre cum și de ce funcționează. Vei avea la dispoziție pentru download imaginile și mostrele necesare. [NOTĂ: Instalare aplicație Desktop necesară]",Todos podem programar com LiveCode,Ensino Médio,Windows ou Mac (instalação obrigatória),Aprenda a programar com LiveCode,"O tutorial ""Todos podem programar com LiveCode"" contém 6 lições em vídeo e uma introdução ao ambiente The LiveCode. Ele mostra como criar o popular jogo ""Sheepherder"" mostrado no YouTube. Assista aos vídeos e os acompanhe com a documentação escrita. Todo o código do jogo está disponível para copiar e colar, com explicações claras sobre como e porque as coisas funcionam. Você vai receber as imagens necessárias e os exemplos para baixar. [OBSERVAÇÃO: É NECESSÁRIA A INSTALAÇÃO NO DESKTOP]"
500,lookingglass,Looking Glass,Washington University Computer Science,ckelleher@seas.wustl.edu,https://lookingglass.wustl.edu/csedweek,Make an animated story,"In this activity, students will be introduced to programming by building an animated story. It introduces computational thinking and showcases the creativity inherent in computing. Furthermore, it incorporates remix actions (animations by other Looking Glass users) highlights the kind of code-reuse that commonly occurs among programmers at all levels, from hobbyist to professional. This is a student-guided activity. [NOTE: Desktop app install required]",Desktop or Game Console,Middle school +,/images/lookingglass.png,Other,https://lookingglass.wustl.edu/pdfs/csEdWeekTeacherNotes.pdf,,,lg,Looking Glass,Gimnaziu,Consolă de joc sau Desktop,Creează o poveste animată,"În această activitate elevii vor fi introduși în învățarea unui limbaj de programare construind o poveste animată. Activitatea introduce gândirea computațională și punând accent pe creativitatea necesară în programare. Mai departe, încorporează acțiuni (animații ale altor utilizatori Looking Glass), evidențiază reutilizabilitatea codului fapt întâlnit frecvent printre programatorii de toate nivelele de la hobby pana la professional. Aceasta activitate poate fi realizată individual. [NOTĂ: Instalare aplicație Desktop necesară]",Looking Glass,Ensino Fundamental II,Desktop ou console de jogos,Faça uma história animada,"Nessa atividade, os alunos vão ser introduzidos à programação a partir da criação de uma história animada. Ela faz uma introdução ao pensamento computacional e à criatividade inerente à computação. Além disso, ela incorpora ações (animações de outros usuários de Looking Glass) e destaca o reuso de código que é tão comum entre os programadores de todos os níveis, dos amadores aos profissionais. Esta é uma atividade autodidata. [OBSERVAÇÃO: é necessária a instalação do aplicativo para Desktop]"
300,kodableunplugged,fuzzFamily Frenzy,Kodable,grechen@kodable.com,/files/fuzzFamilyFrenzy.pdf,A fun unplugged exercise,"Designed for use with plain paper, the fuzzFamily Frenzy is an introduction to programming logic for kids 5 and up. A teacher should explain the game, then students program a partner to complete a simple obstacle course. ",Unplugged,Ages 8-13,/images/fuzzfrenzy.png,Unplugged,,,,ff,fuzzFamily Frenzy,Vârste între 8-13 ani,Unplugged,"Un exercițiu distractiv, unplugged","Creată pentru utilizarea pe hârtie, fuzzFamily Frenzy este o introducere în programare logică pentru copii de la 5 ani. Un profesor ar trebui să explice jocul, apoi elevii provoacă un partener să concureze într-o simplă cursă cu obstacole.",fuzzFamily Frenzy,De 8 a 13 anos,Offline,Um exercício offline divertido,"Desenvolvido para ser usado em papel, o fuzzFamily Frenzy é uma introdução à lógica da programação para crianças a partir de 5 anos. Um professor deve explicar o jogo, e então os alunos programam com um parceiro para transpor um obstáculo simples."