displayweight,code,name,orgname,contact,url,shortdescription,longdescription,platformtext,gradelevel,image,tags,teachers_notes,language,languages_supported,short_code,name_ro,gradelevel_ro,platformtext_ro,shortdescription_ro,longdescription_ro,name_pt,gradelevel_pt,platformtext_pt,shortdescription_pt,longdescription_pt
10000,codeorg,Write your first computer program,Code.org,,http://studio.code.org/hoc/reset,Learn to code with Mark Zuckerberg and Angry Birds!,"Learn the basic concepts of Computer Science with drag and drop programming. This is a game-like, self-directed tutorial starring video lectures by Bill Gates, Mark Zuckerberg, Angry Birds and Plants vs. Zombies. Learn repeat-loops, conditionals, and basic algorithms. Available in 34 languages.","Modern browsers, smartphones, tablets",Ages 4-104,/images/codehoc3.jpg,"Beginner,Mobile,International",https://docs.google.com/document/d/1F0VsFzdaspL-5Qx8RCWd1Qt_euuIBmewT6rFOFzniOo/pub,"Spanish, Portuguese, Italian, Swedish, German, French, Dutch, Greek","ar,ca,cs,da,de,el,en,es,fa,fi,fr,he,hu,id,is,it,ja,ko,nl,no,pl,pt,ro,ru,sr,sv,tr,uk,zh-tw,zh-cn",co,Scrie primul tău program pentru computer,Vârste între 4-104 ani,"Browsere web moderne, Smartphone-uri, Tablete",Învață să programezi cu Mark Zuckerberg si Angry Birds!,"Învață conceptele de bază ale programării cu o metodă simplă, distractivă, drag&drop. Este un tutorial ca un joc, simplu de realizat ce conține clipuri video cu Bil Gates, Mark Zukerberg Angry Birds and Plants vs. Zombies. Învață algoritmi de bază, repeat-loops, conditionals. Disponibil în 34 de limbi.",Escreva seu primeiro programa de computador,De 4 a 104 anos,"Navegadores Web modernos, Smartphones, Tablets",Aprenda a programar com o Mark Zuckerberg e os Angry Birds!,"Aprenda os conceitos básicos de ciência da computação com a programação drag and drop. Este é um tutorial em forma de jogo, com vídeos de Bill Gates, Mark Zuckerberg, Angry Birds e Plants vs. Zombies. Aprenda sobre laços de repetição, estruturas condicionais, e algoritmos básicos. Disponível em 34 idiomas."
9500,thinkersmithspanish,Mis Amigos Roboticos,Thinkersmith,kiki@thinkersmith.org ,/files/Tutorial_Hora_3.pdf,Tutorial para un grupo sin computadoras,"Mediante el uso de un “Vocabulario Robot” predefinido, los estudiantes descubrirán como guiarse de modo tal de llevar a cabo tareas específicas sin ser estas discutidas previamente. Este segmento enseña a los estudiantes la conexión entre símbolos y acciones así como la valiosa habilidad de depuración.",Unplugged,Por todos,/images/roboticfriends.jpg,International,,Spanish,es,te,Amicii mei roboți,Toate vârstele,Unplugged,Tutorial pentru grupuri fără computere,"Mediante el uso de un “Vocabulario Robot” predefinido, los estudiantes descubrirán como guiarse de modo tal de llevar a cabo tareas específicas sin ser estas discutidas previamente. Este segmento enseña a los estudiantes la conexión entre símbolos y acciones así como la valiosa habilidad de depuración.",Meus amigos robôs,Todas as idades,Offline,Tutorial para um grupo sem computadores,"Usando um ""vocabulário robótico"" definido previamente, os alunos vão descobrir como guiar uns aos outros para completar tarefas específicas sem discuti-las primeiramente. Essa lição ensina às crianças a conexão entre símbolos e ações, bem como a inestimável habilidade de depuração."
9000,khan,An introduction to JavaScript,KhanAcademy,pamela.fox@gmail.com,https://www.khanacademy.org/r/hour-of-code,Learn to draw in JavaScript,Learn the basics of JavaScript programming while creating fun drawings with your code. Do it on your own or with your class!,Modern Web browsers,Middle school +,/images/khanacademy.png,JavaScript,http://khanacademy.org/r/hour-of-code-for-teachers,,,kh,O introducere în JavaScript,Gimnaziu,"Browsere web moderne, Smartphone-uri, Tablete",Învață sa desenezi în JavaScript,"Învață bazele programării JavaScript, în timp ce desenezi programând. Fă asta singur sau alături de clasă.",Uma introdução ao JavaScript,Ensino Fundamental II,Navegadores Web modernos,Aprenda a desenhar em JavaScript,Aprenda os conceitos básicos da programação em JavaScript criando desenhos divertidos através da programação. Faça isso sozinho ou junto com sua turma!
8750,khanes,An introduction to JavaScript,KhanAcademy,,https://es.khanacademy.org/hour-of-code/hour-of-code-tutorial/v/welcome-hour-of-code,Learn to draw in JavaScript,Learn the basics of JavaScript programming while creating fun drawings with your code. Do it on your own or with your class!,Modern Web browsers,Middle school +,/images/khanacademy.png,International,,Spanish,es,ke,O introducere în JavaScript,Gimnaziu,Browsere web moderne,Învață sa desenezi în JavaScript,"Învață bazele programării JavaScript, în timp ce desenezi programând. Fă asta singur sau alături de clasă.",Uma introdução ao JavaScript,Ensino Fundamental II,Navegadores Web modernos,Aprenda a desenhar em JavaScript,Aprenda os conceitos básicos da programação em JavaScript criando desenhos divertidos através da programação. Faça isso sozinho ou junto com sua turma!
8500,tynker,Build your own game,Tynker,"kvedati@tynker.com
kchong@tynker.com
Smandyam@tynker.com",http://www.tynker.com/hour-of-code/,"Learn the basics of programming in a fun, visual environment","A collection of 8 fun activities for children of all ages to try programming. Solve a series of simple puzzles to help Pixel the puppy reach home, and Biff the spaceman reach his moon base. Build the Space Zombies game or create Math Art using our fun and easy visual approach to programming.  The session can be teacher facilitated or self-paced.",Modern web browsers,Ages 5-13,/images/tynker.png,"Beginner,Other",http://www.tynker.com/support/hour-of-code-help,,,ty,Creează o felicitare,Vârste între 5-13 ani,Browsere web moderne,Creează o felicitare interactivă,"Cu Scratch, poți sa programezi propriile jocuri interactive, povești, animații și altele. Cu această activitate, vei putea crea o felicitare interactivă pe care o vei putea trimite familiei sau prietenilor.",Crie um cartão de boas-festas,De 5 a 13 anos,Navegadores Web modernos,Crie um cartão interativo,"Com o Scratch, você pode programar seus próprios jogos interativos, histórias, animações e muito mais. Nessa atividade, você vai criar um cartão de boas-festas interativo que poderá compartilhar com sua família e seus amigos."
8000,scratch,Create a holiday card,Scratch,"sayamindu@media.mit.edu
amos@scratch.mit.edu",http://scratch.mit.edu/hoc,Create an interactive card,"With Scratch, you can code your own interactive games, stories, animations, and more. In this activity, you'll create an interactive holiday card that you can share with friends and family.",Any browser,Ages 8+,/images/scratch.png,"Beginner,IE8",http://scratched.gse.harvard.edu/hoc/,,,sc,Costruiește propriul tău joc,Vârstă 8+,,"Învață bazele programării într-un mediu vizual, distractiv","O colecție de 8 activități distractive pentru copii de toate vârstele, pentru a învăța programare. Rezolvă o serie de puzzle-uri simple pentru a-l ajuta pe Pixel cățelul să ajungă acasă și pe cosmonautul Biff sa ajungă la baza de pe lună. Construiește jocul Space Zombies sau creează Math Art folosind metoda noastră simplă și distractivă de programare. Sesiunea poate fi individuală sau alături de profesor.",Crie seu próprio jogo,A partir de 8 anos,Qualquer navegador,Aprenda os conceitos básicos de programação em um ambiente visual divertido,"Um conjunto de 8 atividades divertidas para que crianças de todas as idades possam tentar programar. Resolva uma série de desafios simples para ajudar Pixel a voltar para casa, e para ajudar o astronauta Biff a chegar à base na lua. Crie o jogo Space Zombies ou Math Art usando uma abordagem de programação fácil e divertida. A sessão pode ser feita com o auxílio de um professor, ou então de forma individual."
7500,thinkersmith,My Robotic Friends,Thinkersmith,info@thinkermith.org,http://csedweek.org/unplugged/thinkersmith,Unplugged tutorial for a group with no devices,"Using a pre-defined ""Robot Vocabulary"" students will figure out how to guide each other to accomplish specific tasks without discussing them first. This lesson teaches children the connection between symbols and actions, as well as the invaluable skill of debugging. ""My Robotic Friends"" works best as a group activity and includes a teacher workbook for classroom use.",Unplugged,All ages,/images/roboticfriends.jpg,"Unplugged,IE8",,,,ts,Amicii mei roboți,Toate vârstele,Unplugged,Tutorial pentru grupuri fără computere sau dispozitive,"Folosind un ""Robot Vocabulary"" predefinit elevii vor învăța să se ghideze în rezolvarea unor taskuri predefinite fară a le discuta prealabil. Această lecție, învață copiii conexiunea dintre simboluri si acțiuni, alături de abilitatea testării. ""My Robotic Friends"" funcționează cel mai bine în cadrul unui grup și conține un workbook pentru profesor, ce poate fi folosit la clasă.",Meus amigos robôs,Todas as idades,Offline,Tutorial offline para um grupo que não tem dispositivos eletrônicos,"Usando um ""vocabulário robótico"" definido previamente, os alunos vão descobrir como guiar uns aos outros para completar tarefas específicas sem discuti-las primeiramente. Essa lição ensina às crianças a conexão entre símbolos e ações, bem como a inestimável habilidade de depuração. ""Meus amigos robôs"" funciona melhor como uma atividade em grupo e inclui um livro para que o professor use em sala de aula."
7000,lightbot,Lightbot,Lightbot,contact.lightbot@gmail.com,http://light-bot.com/hoc.html,A game to teach coding concepts,"Learn core programming logic, starting from super-basic programming, for ages 4+, on iOS or Android (or Web browser) . Learn how to sequence commands, identify patterns, use procedures, and utilize loops!","iOS, Android (or web browser)",All ages,/images/lightbot.png,"Beginner,IE8,Apps,Mobile",,,,lb,Lightbot,Toate vârstele,"iOS, Android (sau browser web)",Un joc pentru învățarea conceptelor programării,"Învață bazele logice ale programării, începând de la 4 ani pe iOS, Android sau browser web. Învață secvențialitatea comenzilor, identificarea pattern-urilor, utilizarea procedurilor si a LOOP-urilor!",Lightbot,Todas as idades,"iOS, Android (ou navegador Web)",Um jogo para ensinar conceitos de programação,"Aprenda a essência da lógica de programação, começando do básico, para crianças a partir de 4 anos, em iOS ou Android (ou navegador web). Aprenda a executar comandos em sequência, identificar padrões e usar funções e laços!"
6750,lightbotintl,Lightbot,Lightbot,,http://light-bot.com/hocflash.html,A game to teach coding concepts,"Learn core programming logic, starting from super-basic programming, for ages 4+, on iOS or Android (or Web browser) . Learn how to sequence commands, identify patterns, use procedures, and utilize loops!","iOS, Android (or web browser)",All ages,/images/lightbot.png,International,,"French, Russian, Brazilian Portuguese","fr,ru,pt",li,Lightbot,Toate vârstele,"iOS, Android (sau browser web)",Un joc pentru învățarea conceptelor programării,"Învață bazele logice ale programării, începând de la 4 ani pe iOS, Android sau browser web. Învață secvențialitatea comenzilor, identificarea pattern-urilor, utilizarea procedurilor si a LOOP-urilor!",Lightbot,Todas as idades,"iOS, Android (ou navegador Web)",Um jogo para ensinar conceitos de programação,"Aprenda a essência da lógica de programação, começando do básico, para crianças a partir de 4 anos, em iOS ou Android (ou navegador web). Aprenda a executar comandos em sequência, identificar padrões e usar funções e laços!"
6500,codecademy,Codecademy,Codecademy,ryan@codecademy.com,http://www.codecademy.com/hour_of_code,"Learn JavaScript programming, in a web-browser","Codecademy is an interactive, student-guided introduction to the basics of CS through JavaScript that's used by tens of millions of students around the world. We've prepared a no-hassle Hour of Code experience with accompanying quizzes, slides, and a completed project for students at the end.","Modern web browsers. iOS, Android apps",High school,/images/codecademy.png,"JavaScript,Mobile,International",,Spanish,es,ca,Codecademy,Liceu,"Browsere web moderne, iOS, Android",Învață programare JavaScript într-un browser web,"Codeacademy este o platformă interactivă. ce oferă o introducere în bazele programării cu ajutorul JavaScript, ce se pretează studiului individual fiind utilizată de zeci de milioane de elevi din întreaga lume. Am pregatit o adevărată experiență Hour of Code cu teste si slide-uri și un proiect complet pentru elevi la final.",Codecademy,Ensino Médio,"Navegadores Web modernos, iOS, Aplicativos Android",Aprenda a programar em JavaScript em um navegador Web,"A Codecademy é uma introdução interativa e autodidata aos conceitos básicos de ciência da computação com JavaScript, usada por dezenas de milhões de alunos em todo o mundo. Preparamos a Hora do Código para uma experiência sem complicações, com desafios, slides e um projeto concluído para os alunos no final."
6000,kodable,Kodable,Kodable,jon@surfscore.com,https://itunes.apple.com/us/app/kodable/id577673067?mt=8,A fun iPad game to teach computer programming concepts,"Kodable is a self-guided iPad game that introduces kids 5+ to programming basics. Having a teacher or parent nearby is optimal, but not necessary.",iPad,Elementary,/images/kodable.png,"Apps,Mobile,International",,,"ar,az,de,el,en,es,fa,fr,id,is,it,ko,nl,no,pl,pt,ro,ru,sr,sv,tr,uk,zh",ko,Kodable,Școală primară,iPad,"Un joc distractiv pentru iPad, pentru învățarea conceptelor de bază în programare","Kodable este un joc pentru iPad intuitiv, ce introduce copiii de peste 5 ani în bazele programarii. A avea un parinte sau profesor în preajma este optim dar nu neaparat necesar.",Kodable,Ensino Fundamental I,iPad,Um jogo divertido para iPad que ensina conceitos de programação,"Kodable é um jogo para iPad que apresenta os conceitos básicos de programação para crianças com 5 anos ou mais. Ter um professor ou pai por perto é o ideal, mas não é necessário."
5500,hopscotch,Hopscotch: Code on your iPad,Hopscotch,,http://gethopscotch.com/hour-of-code,Learn visual programming on an iPad,Student-guided tutorial on the iPad using the Hopscotch programming language. Students will build games and apps for their iPad on their iPad. Students can work individually or with friends (up to 3 per iPad).,iPad,Middle school +,/images/hopscotch.png,"Apps,Mobile",,,,hs,Hopscotch: Programează pe iPad,Gimnaziu,iPad,Învață programare vizuală pe un iPad,"Tutoriale pentru elevi pentru iPad utilizând limbajul de programare Hopscotch. Elevii vor construi jocuri si aplicații pentru iPad, de pe iPad. Ei pot lucra individual sau în perechi de 3 la un iPad.",Hopscotch: programe em seu iPad,Ensino Fundamental II,iPad,Aprenda programação visual em um iPad,"Tutorial autodidata para iPad, usando a linguagem de programação Hopscotch. Os alunos vão criar jogos e aplicativos para iPad em seus iPads. Os alunos podem trabalhar individualmente ou em grupo com seus amigos (até 3 pessoas por iPad)."
5000,groklearning,A taste of Python programming,Grok Learning,tim@groklearning.com,https://groklearning.com/hoc,Basic intro to python programming,"Choose from 3 activities designed to give you your first experience programming. For example, use the programming language Python to build a chatbot called ""Eliza"". Can she fool your friends into think she's a human not a computer? This can be done in either a student-guided or teacher-facilitated form and comes with all notes and solutions.",Modern web browsers,Middle school +,/images/groklearning.png,OtherLang,,,,gr,Puțină programare Python,Gimnaziu,Browsere web moderne,Intro pentru bazele programării Python,"Alege din 3 activități realizate să îți ofere o prima experiență a programării. De exemplu utilizează limbajul de programare Python, pentru a construi ub chatbot pe nume ""Eliza"". Crezi ca poate sa îți pacalească prietenii să creada ca este om și nu un computer? Activitățile pot fi realizate individual de elevi sau cu ajutorul profesorului și vine cu toate notele și soluțiile necesare.",Uma amostra da programação em Python,Ensino Fundamental II,Navegadores Web modernos,Introdução básica à programação em Python,"Escolha uma de 3 atividades desenvolvidas para proporcionar sua primeira experiência de programação. Por exemplo, use a linguagem de programação Python para criar um chatbot chamado ""Eliza"". Será que ela pode enganar seus amigos para que eles pensem que ela é uma humana, e não um computador? Essa atividade pode ser feita de forma autodidata ou com a orientação de um professor, que facilita o trabalho através de notas e soluções."
4500,processing,Drawing with Code,Processing,daniel.shiffman@nyu.edu,http://hello.processing.org/,A one hour tutorial in the Processing languages,An introduction to programming in the context of the visual arts using the Processing programming language. Short video lessons introduce coding exercises that lead to designing an interactive drawing program,Modern web browsers,High school,/images/processing.png,OtherLang,,,,pr,Desenează programând,Liceu,Browsere web moderne,Un tutorial de o oră pentru programare Processing,"O introducere în programare în contextul artelor vizuale utilizând limbajul de programare Processing. Lecții video scurte, prezinta exerciții de programare ce conduc la realizarea unui program de desenare interactiv.",Desenhando com programação,Ensino Médio,Navegadores Web modernos,Um tutorial de uma hora à linguagem Processing,Uma introdução à programação no contexto das artes visuais usando a linguagem de programação Processing. Pequenas lições em vídeo introduzem exercícios de programação que levam ao desenvolvimento de um programa de desenho interativo.
4000,robomind,Program a virtual robot,RoboMind Academy,Ernst@robomind.net ,http://www.robomindacademy.com/go/navigator/storylines?course=HourOfCode,Write code for a virtual robot,"Students learn the basics of programming by controlling their own virtual robot. The online course is fully self-contained with short presentations, movies, quizzes and automatic guidance/hints to help with the programming exercises. ","Modern web browsers, Mobile web",Ages 8-13,/images/robomind.jpg,OtherLang,http://www.robomindacademy.com/go/navigator/coursedetails?course=HourOfCode,,,rm,Programează un robot virtual,Vârste între 8-13 ani,"Browsere web moderne, Mobile web",Programează pentru un robot virtual,"Elevii învață bazele programării controlând robotul lor virtual. Cursul online conține prezentări scurte, filme, teste si recomandări automate/ indicii, pentru a ajuta la rezolvarea exercițiilor de programare.",Programação de um robô virtual,De 8 a 13 anos,"Navegadores Web modernos, Web móvel",Programe um robô virtual,"Os alunos aprendem os conceitos básicos de programação controlando seu próprio robô virtual. O curso on-line é completamente autossuficiente, com pequenas apresentações, vídeos, desafios e orientações/dicas automáticas que ajudam na realização dos exercícios de programação."
3750,robomindnl,Program a virtual robot,RoboMind Academy,,http://www.robomindacademy.com/go/robomind/home?lang=nl,Write code for a virtual robot,"Students learn the basics of programming by controlling their own virtual robot. The online course is fully self-contained with short presentations, movies, quizzes and automatic guidance/hints to help with the programming exercises. ","Modern web browsers, Mobile web",Ages 8-13,/images/robomind.jpg,International,,Dutch,nl,rd,Programează un robot virtual,Vârste între 8-13 ani,"Browsere web moderne, Mobile web",Programează pentru un robot virtual,"Elevii învață bazele programării controlând robotul lor virtual. Cursul online conține prezentări scurte, filme, teste si recomandări automate/ indicii, pentru a ajuta la rezolvarea exercițiilor de programare.",Programação de um robô virtual,De 8 a 13 anos,"Navegadores Web modernos, Web móvel",Programe um robô virtual,"Os alunos aprendem os conceitos básicos de programação controlando seu próprio robô virtual. O curso on-line é completamente autossuficiente, com pequenas apresentações, vídeos, desafios e orientações/dicas automáticas que ajudam na realização dos exercícios de programação."
3500,makegameswithus,Build an iPhone game in your browser!,MakeGamesWithUs,gerald@makegameswith.us,http://www.makegameswith.us/build-an-ios-game-in-your-browser,Learn to make an iPhone game in an hour,"Know some programming already? Learn to make an iPhone game in an hour! We'll guide you through the process, to code, test, and play your game entirely in the browser and then share it on Facebook for friends to try! No prior iPhone development experience is required. You must understand what variables, methods, and objects are.",Modern Web browsers,High school,/images/makegameswithus.png,"OtherLang,MakeApps",,,,mg,Construiește un joc pentru iPhone în browser,Liceu,Browsere web moderne,Învață să faci un joc pentru iPhone într-o oră,"Știi ceva programare deja? Învață să construiești un joc pentru iPhone într-o oră. Noi te ghidăm în acest timp să programezi, să testezi, și să joci jocul tău utilizănd un browser, ca mai apoi să îl distribui și prietenilor de pe Facebook sa îl încerce. Nu este necesară experiență anterioară, trebuie doar să întelegi ce reprezintă variabilele, metodele și obiectele.",Crie um jogo para iPhone no seu navegador!,Ensino Médio,Navegadores Web modernos,Aprenda a criar um jogo para iPhone em uma hora,"Já sabe alguns conceitos de programação? Aprenda a criar um jogo para iPhone em uma hora! Vamos orientá-lo no processo de programação, teste, e também na hora de jogar seu jogo no navegador, e então compartilhá-lo no Facebook para que seus amigos o joguem! Não é preciso experiência prévia em iPhone. Você precisa saber o que são variáveis, métodos e objetos."
3000,appinventor,AppInventor Hour of Code,MIT Center for Mobile Learning @ The Media Lab,"jsheldon@mit.edu)
mckinney@mit.edu",http://appinventor.mit.edu/hour-of-code,Make your own app! (Android-only),"Entertaining, quick video tutorials walk you through building three simple apps for your Android phone or tablet. Designed for novices and experts alike, this hour of code will get you ready to start building your own apps before you know it. Imagine sharing your own app creations with your friends! These activities are suitable for individuals and for teachers leading classes.",Modern browser + Android,Middle school +,/images/appinventor.jpg,"Beginner,MakeApps",http://appinventor.mit.edu/hour-of-code/teach,,,ai,AppInventor Hour of Code,Gimnaziu,"Browsere web moderne, Aplicații Android",Construiește-ți propria aplicație! (Doar pentru Android),"Clipuri video interactive te ajută să creezi 3 aplicații simple pentru tableta sau telefonul tău Android. Create pentru începători și avansați deopotrivă, aceasta oră de programare te va ajuta să creezi propriile tale aplicații mai repede decât crezi. Imaginează-ți cum ar fi să arăți prietenilor aplicații programate de tine. Aceste activități se pretează lucrului individual dar si lecțiilor la clasă.",AppInventor da Hora do Código,Ensino Fundamental II,"Navegadores Web modernos, Android",Crie seu próprio aplicativo! (Apenas para Android),"Esses tutoriais rápidos e divertidos orientam no desenvolvimento de três aplicativos simples para Android. Desenvolvido para programadores novatos e experientes, essa hora de código vai preparar você para criar seus próprios aplicativos. Imagine compartilhar seu próprio aplicativo com seus amigos! Essas atividades podem ser feitas individualmente ou usadas por professores em sala de aula."
2500,touchdevelop,TouchDevelop,Microsoft Research,nikolait@microsoft.com,https://www.touchdevelop.com/hourofcode2,"Code mobile apps directly on your phone, tablet or laptop","Crazy drawings, flying monsters, swirling flowers… create your apps on your device with TouchDevelop, a friendly mobile app creation environment. Runs on iPhone, iPad, Android, Windows, Windows Phone, Linux, Mac.","Modern browsers, smartphones, all devices",High school,/images/touchdevelop.png,"Other,MakeApps,Mobile",https://www.touchdevelop.com/docs/hourofcodeeducatornotes,,,td,TouchDevelop,Liceu,"Browsere web moderne, Smartphone-uri, Toate device-urile","Programează aplicații de mobil direct de pe telefon, tabletă sau laptop","Desene ciudate, monștri zburători, Crazy drawings, flying monsters, flori cățărătoare… creează-ți propriile aplicații pe device-ul tău cu TouchDevelop, un mediu prietenos de programare a aplicațiilor. Merge pe iPhone, iPad, Android, Windows, Windows Phone, Linux, Mac. ",TouchDevelop,Ensino Médio,"Navegadores Web modernos, Smartphones, Todos os dispositivos","Programe aplicativos para dispositivos móveis no seu celular, tablet ou notebook","Desenhos malucos, monstros voadores, flores rodopiantes… crie seus aplicativos em seu dispositivo móvel com TouchDevelop, um ambiente de desenvolvimento amigável para dispositivos móveis. Ele pode ser executado em iPhone, iPad, Android, Windows, Windows Phone, Linux e Mac."
